{"selected_route":"template_retrieval","route_intents":["merch","ecommerce"],"template_candidates":["template-cartoon-character-profile-card-kawaii-style","template-industrial-design-concept-sketch","template-product-poster"],"needs_clarification":false,"plan":[{"stage":"understand","action":"提炼唐代仕女、三头身比例与潮玩手办的造型和文化元素需求。"},{"stage":"retrieve","action":"优先匹配卡通角色设定、产品概念草图和手办展示海报模板。"},{"stage":"generate","action":"基于所选模板规划唐代服饰特征鲜明、比例可爱且适合实体化的手办视觉方案。"},{"stage":"verify","action":"检查唐代风格识别度、三头身比例、潮玩质感及商品展示适配性。"}],"rationale":"请求核心是具有唐代文化造型的Q版实体潮玩，首属文创商品设计，并可延伸至电商展示；角色卡、工业设计草图和产品海报模板均有直接适配性。"}