{"selected_route":"virtual_tryon","route_intents":[],"template_candidates":[],"needs_clarification":false,"plan":[{"stage":"understand","action":"Identify the supplied person photo as the model reference and the supplied jacket image as the garment reference for a lookbook-style result."},{"stage":"generate","action":"Create a virtual try-on that places the jacket naturally on the person while preserving identity, pose, body proportions, and recognizable garment details."},{"stage":"verify","action":"Check fit, occlusion, fabric details, lighting consistency, and overall suitability for a polished lookbook image."}],"rationale":"The request explicitly asks to place a supplied jacket on a supplied person photo, and both required reference inputs are available."}