{"selected_route":"factory_export","route_intents":[],"template_candidates":[],"needs_clarification":false,"plan":[{"stage":"understand","action":"Use the supplied sticker artwork as the source and determine its outer contour for production."},{"stage":"export","action":"Create a die-cut cutline as a dedicated spot-color vector path and prepare the artwork in CMYK for print."},{"stage":"verify","action":"Check cutline closure, bleed and safety spacing, spot-color naming, CMYK conversion, dimensions, and export compatibility."}],"rationale":"The request is specifically for print/manufacturing preparation of supplied sticker artwork, so it routes to factory export."}