{"selected_route":"design_vote","route_intents":[],"template_candidates":[],"needs_clarification":false,"plan":[{"stage":"understand","action":"识别候选板中的4款包装及其面向消费者的核心视觉差异。"},{"stage":"evaluate","action":"从材质感、色彩与印刷观感、版式层级、细节精致度、品牌可信度和货架吸引力等维度进行对比评分。"},{"stage":"verify","action":"综合评分并检查判断是否受到展示角度或渲染效果影响，给出质感排名、首选方案及简要理由。"}],"rationale":"请求明确要求比较并选择4款现有包装中更有质感的一款，且已提供候选板，适合走设计评选路线。"}