{"selected_route":"template_retrieval","route_intents":["merch","ecommerce"],"template_candidates":["template-cartoon-character-profile-card-kawaii-style","template-industrial-design-concept-sketch","template-food-product-packaging-design"],"needs_clarification":true,"plan":[{"stage":"understand","action":"Define the cultural tradition, mascot symbolism, audience, collectible format, and blind-box packaging requirements."},{"stage":"retrieve","action":"Compare the selected templates for character development, collectible presentation, and packaging layout."},{"stage":"generate","action":"Adapt the best template structure into a cohesive heritage mascot and blind-box packaging concept."},{"stage":"evaluate","action":"Check cultural authenticity, character appeal, merchandising coherence, and packaging practicality."},{"stage":"verify","action":"Confirm that the mascot and package form one consistent collectible product system."}],"rationale":"The request is primarily merchandise design with a secondary commercial-product intent. The character-profile template best supports the mascot, while the industrial-design and packaging templates cover the collectible form and blind-box presentation. Clarification is needed because the specific cultural heritage and product constraints are unspecified."}