{"selected_route":"template_retrieval","route_intents":["merch","education"],"template_candidates":["template-ethnic-costume-deconstruction-board","template-intangible-heritage","template-cultural-relic-retro-infographic"],"needs_clarification":false,"plan":[{"stage":"understand","action":"解析传统服饰结构展示与文创海报的内容层级、文化主题和视觉诉求。"},{"stage":"retrieve","action":"优先检索民族服饰拆解板模板，并以非遗和复古文化图鉴模板作为备选。"},{"stage":"generate","action":"基于选定模板规划服饰整体形象、结构拆解标注、文化说明与文创宣传信息。"},{"stage":"verify","action":"检查结构信息清晰度、传统文化表达准确性及海报传播效果。"}],"rationale":"请求兼具传统服饰结构拆解、文化知识展示与文创传播属性，民族服饰拆解板最直接匹配，非遗和文化遗物信息图可作为风格与内容备选。"}