{"selected_route":"template_retrieval","route_intents":["ecommerce","merch"],"template_candidates":["template-product-poster","template-product-theme-promotional-poster","template-industrial-design-concept-sketch"],"needs_clarification":false,"plan":[{"stage":"understand","action":"Interpret the request as a commercial 3D poster featuring floating headphones, using the available reference as visual guidance."},{"stage":"retrieve","action":"Retrieve product-poster templates that support a strong hero object, depth, and promotional composition."},{"stage":"generate","action":"Adapt the best template with suspended headphones, dimensional lighting, shadows, and concise product copy."},{"stage":"verify","action":"Check reference consistency, product prominence, readable hierarchy, and convincing 3D suspension."}],"rationale":"耳机是海报中的核心实体商品，且“悬浮3D海报”明确指向商业产品主视觉；通用产品海报和主题促销海报最匹配，工业设计草图仅作为偏概念展示的备选。"}