{"selected_route":"template_retrieval","route_intents":["merch","ecommerce","lifestyle"],"template_candidates":["template-country-souvenirs-watercolor","template-food-product-packaging-design","template-intangible-heritage"],"needs_clarification":true,"plan":[{"stage":"retrieve","action":"优先匹配城市伴手礼、实体商品包装与成都地域文化表达相关模板。"},{"stage":"evaluate","action":"比较候选模板对礼盒结构、系列化包装和城市文化符号的适配度。"},{"stage":"ask","action":"后续确认礼包内容、包装尺寸、目标客群及期望视觉风格，以确定最终模板。"}],"rationale":"该请求核心是成都地域文化伴手礼的实体包装设计，首属 merch，并兼具商品营销与城市生活方式叙事；现有目录中城市纪念品、产品包装和非遗文化模板最贴合。"}