{"selected_route":"template_retrieval","route_intents":["ecommerce","merch","lifestyle"],"template_candidates":["template-product-theme-promotional-poster","template-product-poster","template-interior-design-mood-board-generator"],"needs_clarification":true,"plan":[{"stage":"retrieve","action":"Retrieve the best-fit product promotion and mood-board templates for a minimalist home-fragrance launch kit."},{"stage":"ask","action":"Confirm the brand name, product range, visual palette, required launch assets, and output formats."},{"stage":"generate","action":"Adapt the selected template system into a cohesive set of launch visuals with consistent typography, packaging cues, and fragrance-focused imagery."},{"stage":"evaluate","action":"Check visual consistency, product hierarchy, legibility, and suitability across the requested brand touchpoints."},{"stage":"export","action":"Prepare the approved kit in the required sizes and formats."}],"rationale":"The request centers on commercial product launch marketing, physical-product branding, and a lifestyle-led home aesthetic. Product promotion templates are the strongest fit, with the interior mood-board template supporting the minimalist fragrance art direction."}