{"selected_route":"template_retrieval","route_intents":["ecommerce","merch"],"template_candidates":["template-product-theme-promotional-poster","template-product-poster","template-fashion-ecommerce"],"needs_clarification":false,"plan":[{"stage":"understand","action":"解析产品参考图与配色参考，确认同一产品的造型、材质和五种目标颜色。"},{"stage":"retrieve","action":"优先检索适合展示单品多色款式的商品推广模板，并评估版式对五个颜色版本的容纳能力。"},{"stage":"generate","action":"基于最佳模板规划主产品与五种颜色变体的统一展示版式。"},{"stage":"verify","action":"核对五种颜色是否齐全、产品外形是否一致，以及电商展示层级是否清晰。"}],"rationale":"请求核心是展示同一产品的五种配色，属于电商商品营销场景；产品主题推广海报最适合多色变体陈列，通用产品海报与时尚电商模板可作为备选。"}