{"selected_route":"template_retrieval","route_intents":["merch","ecommerce"],"template_candidates":["template-industrial-design-concept-sketch","template-country-souvenirs-watercolor","template-product-theme-promotional-poster"],"needs_clarification":true,"plan":[{"stage":"understand","action":"明确文创主题、产品类型、文化元素、受众及应用场景。"},{"stage":"retrieve","action":"优先检索适合文创实体产品概念设计、地域纪念品和产品推广的模板。"},{"stage":"verify","action":"根据补充需求核对模板与设计载体、风格及商业用途的匹配度。"}],"rationale":"“文创设计”通常指文化创意商品及其商业呈现，但当前缺少主题、载体和风格信息；优先匹配产品概念设计与文化纪念品模板。"}