{"selected_route":"template_retrieval","route_intents":["ecommerce","education"],"template_candidates":["template-product-theme-promotional-poster","template-product-poster","template-educational-topic-infographic"],"needs_clarification":true,"plan":[{"stage":"understand","action":"结合参考输入识别产品类型、核心功能、目标受众及所需图标范围。"},{"stage":"retrieve","action":"按优先顺序检索产品主题推广、产品海报和说明型信息图模板。"},{"stage":"generate","action":"基于选定模板规划产品功能说明图的信息层级、功能卖点与配套图标。"},{"stage":"verify","action":"核对功能文案准确性、图标语义一致性及整体可读性。"}],"rationale":"请求以产品功能展示为核心，兼具商业传播与解释说明属性；现有参考输入可辅助生成，但产品类别、功能清单和输出规格未明确。"}