{"selected_route":"template_retrieval","route_intents":["merch","ecommerce"],"template_candidates":["template-food-product-packaging-design","template-product-theme-promotional-poster","template-cultural-relic-retro-infographic"],"needs_clarification":true,"plan":[{"stage":"understand","action":"明确茶品牌、联名博物馆、文物或馆藏主题，以及所需载体与视觉风格。"},{"stage":"retrieve","action":"优先检索食品包装、产品主题推广和文博复古视觉模板。"},{"stage":"generate","action":"基于选定模板规划融合茶产品特征与博物馆文化元素的联名视觉方案。"},{"stage":"verify","action":"核对品牌识别、馆藏元素适配性、授权边界与不同载体的可读性。"}],"rationale":"该请求指向茶产品与博物馆文化资源结合的商业联名视觉，核心是文创或包装等实体商品设计，同时兼具品牌推广属性；具体载体和馆藏主题尚未给出。"}