{"selected_route":"template_retrieval","route_intents":["merch","ecommerce"],"template_candidates":["template-product-theme-promotional-poster","template-product-poster","template-intangible-heritage"],"needs_clarification":true,"plan":[{"stage":"understand","action":"明确京剧脸谱徽章盲盒的商品主题、目标受众与展示用途。"},{"stage":"retrieve","action":"优先检索主题商品推广、单品海报及非遗文化视觉模板。"},{"stage":"generate","action":"基于所选模板规划盲盒系列、徽章款式与商品卖点的版面内容。"},{"stage":"verify","action":"检查京剧文化表达、商品信息层级与商业展示适配性。"}],"rationale":"该请求核心是具有京剧文化主题的实体徽章盲盒，优先匹配文创周边与电商推广模板；具体尺寸、渠道和风格尚未说明。"}