{"selected_route":"template_retrieval","route_intents":["ecommerce","lifestyle"],"template_candidates":["template-interior-design-mood-board-generator","template-lifestyle-photo-grid","template-architecture"],"needs_clarification":false,"plan":[{"stage":"understand","action":"解析精品酒店的品牌定位、视觉关键词与参考输入。"},{"stage":"retrieve","action":"优先检索室内设计情绪板模板，并以生活方式照片网格和建筑模板作为备选。"},{"stage":"generate","action":"基于选定模板规划包含色彩、材质、空间氛围、字体与品牌意象的视觉情绪板。"},{"stage":"verify","action":"核对整体视觉是否统一传达精品、独特且具生活方式感的酒店品牌定位。"}],"rationale":"精品酒店情绪板兼具商业品牌塑造与生活方式叙事属性；室内设计情绪板模板与空间氛围、材质和色彩表达最直接匹配。"}