{"selected_route":"template_retrieval","route_intents":["merch","ecommerce"],"template_candidates":["template-product-poster","template-guofeng-scroll","template-product-theme-promotional-poster"],"needs_clarification":false,"plan":[{"stage":"retrieve","action":"检索以文创产品展示为核心、兼具国风茶文化氛围的主视觉模板。"},{"stage":"generate","action":"基于折扇实体、茶文化符号与东方雅致调性生成主视觉方案。"},{"stage":"evaluate","action":"评估产品辨识度、文化表达和商业传播适配性，选出最佳模板方向。"}],"rationale":"需求属于茶文化折扇文创产品主视觉，优先匹配产品海报，并以国风画卷和主题推广模板补充东方文化氛围与营销表现。"}