{"selected_route":"template_retrieval","route_intents":["ecommerce","lifestyle"],"template_candidates":["template-lifestyle-photo-grid","template-product-theme-promotional-poster","template-lifestyle-info-card"],"needs_clarification":false,"plan":[{"stage":"understand","action":"梳理美妆品牌的小红书九宫格用途、内容层级与视觉调性。"},{"stage":"retrieve","action":"优先检索适合九宫格排版、产品推广和生活方式表达的模板。"},{"stage":"evaluate","action":"比较候选模板的网格适配度、品牌展示能力与小红书传播感。"},{"stage":"generate","action":"基于最佳模板规划九张画面的统一版式与内容分工。"},{"stage":"verify","action":"检查整体一致性、移动端可读性及九宫格组合效果。"}],"rationale":"这是面向美妆品牌的小红书商业视觉需求，电商营销意图最强，并兼具生活方式内容属性；照片网格模板与九宫格形式最直接匹配，产品主题推广和生活方式信息卡可作为补充。"}