{"selected_route":"template_retrieval","route_intents":["ecommerce"],"template_candidates":["template-interior-design-mood-board-generator","template-product-theme-promotional-poster","template-product-poster"],"needs_clarification":true,"plan":[{"stage":"understand","action":"明确跨境家居品牌的中英文名称、品牌定位、目标市场与偏好风格。"},{"stage":"retrieve","action":"按家居行业相关性和商业品牌适配度检索候选模板。"},{"stage":"generate","action":"基于选定模板规划中英文字标、图形符号、配色及横竖版组合方案。"},{"stage":"evaluate","action":"评估双语可读性、跨文化辨识度、缩放表现与电商场景适用性。"},{"stage":"export","action":"规划交付彩色版、单色版、透明背景版及常用品牌应用尺寸。"}],"rationale":"该请求属于跨境家居品牌商业视觉，核心意图是电商品牌营销；目录无专用 Logo 模板，因此优先选择家居风格及产品品牌推广相关模板作为设计起点。"}