{"selected_route":"template_retrieval","route_intents":["merch","ecommerce"],"template_candidates":["template-industrial-design-concept-sketch","template-product-theme-promotional-poster","template-product-poster"],"needs_clarification":false,"plan":[{"stage":"retrieve","action":"优先检索适合文创盲盒外观、造型与材质表达的工业设计概念图模板。"},{"stage":"evaluate","action":"比较候选模板对三星堆青铜面具文化元素、盲盒产品展示和商业视觉呈现的适配度。"},{"stage":"generate","action":"基于最佳模板规划盲盒角色造型、青铜纹理、包装及系列化陈列的概念图内容。"}],"rationale":"请求核心是以三星堆青铜面具为主题的实体文创盲盒设计，首要属于 merch，并兼具产品营销属性；工业设计概念草图模板最贴合，产品宣传模板可作为展示型备选。"}