{"selected_route":"template_retrieval","route_intents":["ecommerce"],"template_candidates":["template-product-theme-promotional-poster","template-product-poster","template-international-event-promotional-poster"],"needs_clarification":true,"plan":[{"stage":"ask","action":"补充品牌名称、产品品类、发布会主题、时间地点、画面比例及视觉风格。"},{"stage":"retrieve","action":"优先检索产品主题推广海报与产品海报模板，并以国际活动宣传海报作为发布会场景备选。"},{"stage":"generate","action":"将确认后的品牌资产、产品卖点与发布会信息应用到所选KV模板。"},{"stage":"verify","action":"检查品牌一致性、主信息层级、产品辨识度及多尺寸适配效果。"}],"rationale":"新品发布会KV属于品牌与产品营销场景，电商意图最明确；产品主题推广和产品海报模板最贴合，活动宣传模板可补足发布会氛围。因缺少品牌、产品和活动信息，需要进一步澄清。"}