{"selected_route":"template_retrieval","route_intents":["merch","ecommerce"],"template_candidates":["template-industrial-design-concept-sketch","template-product-theme-promotional-poster","template-guofeng-scroll"],"needs_clarification":true,"plan":[{"stage":"ask","action":"明确文创产品品类、目标文化元素、应用场景与所需交付形式。"},{"stage":"retrieve","action":"优先检索工业设计概念草图、产品主题推广与国风视觉模板。"},{"stage":"generate","action":"基于选定模板规划国潮元素、产品造型、材质配色和品牌展示内容。"},{"stage":"evaluate","action":"评估文化辨识度、产品可实现性及商业传播适配度。"}],"rationale":"请求核心是国潮实体文创设计，首要属于 merch，并兼具 ecommerce 展示需求；产品品类与文化主题尚未明确。"}