{"selected_route":"creative_explore","route_intents":[],"template_candidates":[],"needs_clarification":false,"plan":[{"stage":"understand","action":"Define the tea brand's likely positioning, audience, personality, and product context from the broad prompt."},{"stage":"generate","action":"Develop distinct creative directions for the brand identity, including visual tone, palette, typography, packaging cues, and naming themes."},{"stage":"evaluate","action":"Compare the directions for differentiation, audience fit, and scalability before selecting one for production."}],"rationale":"“Tea brand” supplies a meaningful design domain but no specific asset or production requirements, so it should begin with broad creative exploration."}